text_id,section_num,para_num,para_str
6,9,12,"El Financiero: Somebody asked me why we choose a newspaper that specializess in economic issues as our interlocutor. To say that El Financiero is a finance newspaper is to miss the truth in the best of cases, and in the worst it means that you haven't read it. El Financiero has, it is our understanding, a serious and responsible team of columnists performing their journalistic tasks. Its analysis is objective, and above all, very critical. The ideological plurality of the articles that make up El Financiero is also a richness that is difficult to find in other national newspapers. I mean it is a balanced plurality. Its editorial policy is not satisfied with splashing a critical pen among those aligned with the powerful. It opens real spaces for incisive analysis of both sides. (I doubt that there are only two sides, but the literary figure helps, I think.) Its journalistic team has the instinct to dissect reality, which is what finally distinguishes a journalist from an observer. El Financiero seems to tell us and show us that a social event is a reflection of (""a reflection of?"" I think I should say: ""conditions and is conditioned by"") several economic, political and cultural aspects. Like reading a history book, but of present and everyday history which, by the way, is the most difficult history to read. When I was young and beautiful, intellectuals tended to group around a publication, dig up positions, entrench themselves, and throw truths to the ignorant world of the mortals. In those times they called them the elites of the intelligentsia and there were as many as there were magazines and ideological currents in fashion. Publications to be read by those who published them. Lucha calls them ""an editorial masturbation."" If you, innocent earthling, wanted to brush up against these ivory towers, you had to follow a rough process. If any editorial medium seems to distance itself from this elite journalism that pours off, selects and eliminates, it is El Financiero. This national newspaper did not react with the immediate condemnation of a movement that nobody understood, it did not jump into intense intellectual study that affected, and affects, other media. It waited, which in the art of war is the most difficult virtue to learn; it investigated; it reported and, on a firmer base, it began to weave that interdisciplinary analysis that its readers can now appreciate. We did not know this until, some time later, an issue got to our hands. We congratulated ourselves for a good choice, although, it is only fair to acknowledge, we had nothing to lose. If for La Jornada it was the journalistic team that made us decide, in El Financiero it was the editorial team (not withstanding Mr. Pazos)."
6,9,13,"Proceso: For this weekly, it is worth repeating the apology for its late inclusion among the addressees. The reason for this I have explained elsewhere. I would like to recall an anecdote, of the many that run loose in our minds and chats, of January 1, 1994: At dusk, a majority of the civilian population, who had been curious and scandalized by what they saw, with us in the municipal palace at San Cristóbal de las Casas, had gone into their houses and hotels, scared by the insistent rumors that the Federal Army would try to assault our positions in darkness. However, one or two drunks for whom the New Year's party had gone on for 24 hours, showed up. Keeping their balance with difficulty, they would address us, asking what religious procession we were from because they saw many 'Indians' in the central park. After we would tell them what was happening, they would invite us to a useless sip from an empty bottle and they would leave, staggering and discussing whether the procession was for the Virgin of Guadalupe or for the Fiesta of Santa Lucía. People in their right mind, or at least so they appeared, would also approach us. And then it happened: Spontaneous war strategists and military advisors surged, telling us how to run when the federal troops attacked us and avoid many losses, because with respect to our defeat there was unanimity among them."
6,9,14,"One of them, later in the night and when our troops were getting ready to move to new positions before the assault on Rancho Nuevo, came up to me and, with a tone more paternalistic than doctoral, told me: ""Marcos, you made a strategic mistake by initiating the war on a Saturday."" I adjusted my ski mask that, along with my eyelids, was beginning to droop over my eyes, and ventured, timidly, ""Why?"""
6,9,15,"""Look,"" says my impromptu advisor of military strategy, ""The mistake is that on Saturdays Proceso closes its edition and therefore the analysis and truthful reports about your struggle will not come out until next week."" I continue fixing my ski mask, to give myself some time more than because it was out of place. My military advisor from San Cristóbal adds, relentless: ""You should have attacked on Friday."" I try, timidly, to argue in my defense about the New Year's Eve dinner, the fireworks, the celebrations, the etceteras that I don't remember now, but I must have been saying something, because the character I had in front did not let me continue and interrupted me, saying, ""And now who knows if you will last until next week."" There was no pity in his tone. It was a lugubrious death sentence. He left, giving me an understanding pat for my strategic blunder of attacking on a Saturday. I have not read the Proceso of that week previous to January 1, but if there is something on which the strategist was right that night, it is in that in Proceso truthful analysis and reports do appear. I can add little to the virtues that everyone points out in the journalistic work of this weekly magazine recognized worldwide. It suffices to call attention to the depth that is always present in the articles of Proceso, the diverse focuses on a problem, whether it be national or international."
6,9,16,"Others: I agree with you that there are other media, of equal or greater value than those above mentioned. We will look into increasing the number of addressees or, simply address the press in general. I believe that, finally, this will be the wisest, since there are truly many and good news media that do this: inform."
6,9,17,"El Sur (Oaxaca): I repeat that we did not know about it. I counter - repeat that we do not have the advantages of the Federal Army to give interviews or press conferences, I arch - repeat that we are surrounded and at war. But I propose a deal: Until a personal interview becomes possible, we could advance something by mail. I know that an interview through letters is not ideal for a reporter, but we could send something. Furthermore, I commit myself to finding interviews with other officials of the EZLN, and this without any requisite other than coming to Chiapas and picking up, at the office of the National Commissioner of Mediation, the accreditation as war journalists that the EZLN provides."
6,9,18,"As you must know, the dialogue has not started. Maybe we are waiting for you."
6,9,19,"Well, journalists of El Sur of Oaxaca, I believe I must have bored you enough. However it may be, the great advantage of this long letter is that no medium will dare to publish it. All right."
6,9,20,Good health and a sincere embrace without rancor...agreed?
6,9,21,"From the mountains of the Mexican Southeast, Insurgent Subcommander Marcos"
6,9,22,P.S.: Could you send us an issue of your newspaper? We solemnly promise to pay for it in the improbable case that one day we have money. (Would you accept letters instead of cash?)
6,9,23,"Another P.S.: That airplane simply won't fall, and the water in the pot evaporated while waiting. Why don't you bring some Oaxaca cheese when you come? They say it is very tasty. We will provide the tortillas and the hunger. You're welcome."
6,9,24,"cc: Tiempo, San Cristóbal, Chiapas. cc: La Jornada, Mexico City cc: El Financiero, Mexico City cc: Proceso, Mexico City"
7,1,0,Communique's Concerning Conditions For The Dialogue
7,1,1,[The following are several communique's concerning the dialogue that were released as preparations were being made and delegates were still being chosen.]
7,1,2,"A Letter of Introduction February 16, 1994"
7,1,3,"To the national weekly Proceso: To the national newspaper La Jornada: To the national newspaper El Financiero: To the local newspaper of San Cristóbal de las Casas, Chiapas, Tiempo: To the national and international press:"
7,1,4,Gentlemen:
7,1,5,"Well, here I send you the communique' of the CCRI - CG of the EZLN that defines, in general, the position that it will take to the discussion with the Commissioner for Peace on February 21."
7,1,6,We are intent on seeing that the delegates arrive on time at the points where they will be picked up.
7,1,7,"I am not sure if the noble city of San Cristóbal will welcome them, but, after all, that is the risk we have to take."
7,1,8,"While the CCRI - CG of the EZLN decides whether or not to send me to the dialogue, I am very worried about what clothes to wear (if I do go). I looked with skepticism through the giant wardrobe that I carry in my bag, and I worry anxiously whether winter clothes are still in fashion or if I need to take something coquettish for the spring. In the end, I decided on a coffee - colored shirt (the only one), a pair of black trousers (the only ones), a bright red bandanna (the only one), a pair of dirty boots (the only ones), and a ski -  mask in a discreet shade of black (the only one). Whatever happens, whether I go or not, the CCRI -  CG has ordered me to written silence, therefore I will keep my powerful communique' machine (a pen) until the end of this."
7,1,9,"I wish you health and good luck in the journalistic cannibalism. (Note: leave something for the smallest ones. Take the political initiative and inaugurate the Pronasol of communication, a press - pool, that is.)"
7,1,10,"""The Merchant's Postscript"" Section"
7,1,11,"P.S.: How much would a dirty, smelly ski mask cost in dollars? How much more for the Attorney General (Procurador General de la Republica, PGR)?"
7,1,12,P.S. to the P.S.: How much can you get if some brand of bottled soda appears on the dialogue table?
7,1,13,"P.S. For a high interest rate: How about a streap tease (is that how you spell it?) of ski masks? How much for this show? In other words, how much dough for that?"
7,1,14,"P.S. On the decrease of the Stock Market: How much for one minute of speaking nonsense? How much for a half minute of truths? (Remember that truths are more in demand than lies, and therefore, fewer are sold.)"
7,1,15,P.S. Macho but sought after in the Stock Market: How much for the half personal information from the waist down?
7,1,16,"P.S. Of crack in the Market: How much for an exclusive, a close up, of the big nose?"
7,1,17,"P.S. Devalued by ""external"" pressures: And the ""communique' machine,"" how much for it to continue? How much for it to stop?"
7,1,18,"P.S. It has no monetary value: And for our dead, what is their pain worth? How much light do they fill their pockets with? How much more blood so that their silence will not be useless? Who wants the exclusive on their pain? Nobody? Well..."
7,1,19,P.S. Which pulls out of the stock exchange: Goodbye... I thank those of you who tell the truth. My deepest condolences to those who follow the path of lies. All right.
7,1,20,El sup in ostracization (I merengues)
7,2,0,"An Invitation to the Political Parties to Attend the Dialogue February 13, 1994"
7,2,1,"To the Mexican and international press: To the registered political parties: To the candidates for the presidency of the Mexican Republic: Attention: PAN, PRI, PRD, PFCRN, PT, PARM, PVEM, PPS"
7,2,2,Gentlemen:
7,2,3,"We speak to you through this medium, we the Clandestine Revolutionary Indigenous Committee -  General Command of the Zapatista National Liberation Army, to say to you the following:"
7,2,4,"First: As everyone knows, in a few days the negotiations for peace and reconciliation in Chiapas will begin between the federal government and the EZLN, with Bishop Samuel Ruiz acting as intermediary."
7,2,5,"Second: Opening dialogue is an important part of the peace process, if we set out from the start in the direction of a peace with dignity, justice, freedom, and democracy. However, we think that the accords that we will be able to reach with the federal government's representative may be poorly implemented in the future electoral process and in the coming change in electoral powers."
7,2,6,"Third: Because of this, we invite all of you to send delegations from the national leadership of your political parties in order to keep yourselves informed of the advances of the dialogue for peace, and so you can give us your opinion about the way in which the accords can be implemented, if agreement is possible. We understand that the presidential candidate of one of your parties' will be the next federal executive of our country, and this next President of the Republic will also be responsible for the implementation of the above - mentioned accords."
7,2,7,Fourth: We hope that our invitation to participate in the dialogue will be accepted by the leadership of your parties and the campaign teams of the individual aspirants for the country's highest office. It will be a great honor for us to speak with delegates you may be able to send.
7,2,8,"Respectfully, CCRI - CG of the EZLN"
7,3,0,"To The Conac - LN February 14, 1994"
7,3,1,"To the organizations that make up the National Coordinating Committee of Civic Action for National Liberation (Coodinación Nacional de Acción Cívica para la Liberación Nacional, Conac - LN):"
7,3,2,Brothers and Sisters:
7,3,3,"We received your letter of February 9, 1994. It is a great honor, and our ranks are inclined to recognize the words of our General Emiliano Zapata coming from the mouths of workers, students, teachers, and intellectuals, honest men and women that make up the Conac - LN."
7,3,4,"Following the words of Zapata, we call on the Mexican people who might be aided by the just cause that inspires the song of our rifles. We respectfully salute the return of this call to unity that comes from other parts of our country."
7,3,5,"Brothers and Sisters: For years and years, we have harvested our own death in the countrysides of Chiapas. Our children were dying at the hands of an unknown force. Our men and women were walking in a long night of ignorance that darkened our paths. Our people went without truth or knowledge. They wandered -  - without a destination -  - merely living and dying."
7,3,6,"The oldest of our peoples' elders spoke to us words that came from very far away, from before our lives began, from when our voice was silent. And there is truth in the words of the oldest of our elders. And we learned from their words that our peoples' long night of pain comes from the powerful, that a house for the powerful was built on top of the bones and dust of our ancestors and our children. We learned that we weren't allowed to enter this house, and that the light that illuminated it fed on our darkness, and that the abundance of their table fills itself with the emptiness of our stomachs. Their luxuries were born of our misery, and that the strength of its roofs and walls were raised upon the fragility of our bodies. The health that filled its spaces came from our death. The wisdom that lived there was nourished of our ignorance. The peace that it sheltered was war for our peoples. Foreign vocations sent them far from our land and our history."
7,3,7,"But the truth that is passed along in the words of the oldest of our elders was not only of pain and death. The words of the oldest of our elders also brought hope for our history. And in their words the image of one like us appeared: Emiliano Zapata. And in that image we saw the place where our paths should lead to be true. And it returned our history of struggle to our blood, and our hands filled with the cries of our people, and dignity returned, once again, to our mouths, and our eyes saw a new world."
7,3,8,"And then we made ourselves soldiers, war covered our soil, and we struck out on our paths, newly armed with bullets and fire. Our fear was buried with our dead, and we saw to take our new voice to the land of the powerful, and we carried our truth to plant it in the middle of the land where falsehood rules. We arrived in the city carrying our dead to show them to the eyes of the blind compatriots, the good and the bad, the knowledgeable and the ignorant, the powerful and the meek, and the rulers and the subjects. Our cries of war opened the deaf ears of the supreme government and its accomplices. For years and years before our voice of dignified peace could not descend from the mountains; the rulers raised strong, high walls to hide our death and misery. Our force must break down those walls in order to enter, once again, our history, which they have stolen along with the dignity and reason of our people."
7,3,9,"In that first blow at the deaf walls of those who have everything, our blood ran generously to wash away the injustice that we are living. In order to live, we die. Our dead return to travel the paths of truth. With mud and blood we pay for our hope."
7,3,10,"But the words of the oldest of our elders didn't stop there. They spoke the truth, saying that our paths cannot be travelled alone, that our history of pain and hardship is repeated and multiplied in the flesh and blood of brothers and sisters of other lands and skies."
7,3,11,"""Raise your voice to the ears of the other dispossessed, raise your struggle to other struggles. There is another roof of injustice over he who hides our pain,"" said the oldest of our elders. We saw in these words that if our struggle was alone, once again it would be useless. So we directed the flow of our blood and the paths of our dead to find the path of others who walk with truth. We are nothing if we go alone, we are everything if we walk together with others who are dignified."
7,3,12,"Brothers and sisters, our thoughts have reached our hands and our lips. And we begin to move forward that your paths should come towards us, brothers and sisters of the National Coordinating Committee of Civic Action for National Liberation, our heart is open to your word and truth. We have little to offer you, since we continue to feel the huge poverty of our lands and our very small place in Mexican history. But together with your path, and that of all good people of this world, we will grow and find, in the end, the place our dignity and our history deserve."
7,3,13,"Good health, brothers and sisters of the Conac -  LN."
7,3,14,Liberty! Justice! Democracy!
7,3,15,"Respectfully,"
7,3,16,"From the mountains of the Mexican Southeast, CCRI - CG of the EZLN"
7,4,0,"An Invitation to the PDM and the UNO to Attend the Dialogue February 15, 1994"
7,4,1,"To the registered political parties: The Mexican Democratic Party (Partido Demócrata Mexicano, PDM), the National Opposition Union (Unión Nacional Opositora, UNO): To their candidates for the presidency of the Mexican Republic:"
7,4,2,Gentlemen:
7,4,3,"We speak to you through this medium, we the Clandestine Revolutionary Indigenous Committee of the Zapatista National Liberation Army, to say to you the following:"
7,4,4,"First: Due to a regrettable error caused by haste and a lack of attention, the names of your political organizations were omitted from the list of addresses of our invitation to send delegations to the negotiations for peace and reconciliation in Chiapas. We deeply regret this error and sincerely hope that you will forgive us and honor us with the presence of your delegates at such an important event."
7,4,5,"Second: The opening of the dialogue is an important part of the peace process; if we set out from the start, in the direction of a peace with dignity, justice, liberty, and democracy. However, we think that the accords that can be reached with the federal government's representative may be limited in their implementation by the future electoral process and the change in federal powers that is drawing near."
7,4,6,"Third: Because of this, we invite you to send delegations from the national leadership of your political parties in order to keep yourselves informed of the advances of the dialogue for peace, and so you can give us your opinion about the way in which accords can be implemented if agreement is possible. We understand that one of your parties' presidential candidates will be the next federal executive of our country, and this next president of the Republic will also be responsible for the implementation of the above -  mentioned accords."
7,4,7,Fourth: We hope that our invitation to participate in the dialogue will be accepted by the leadership of your parties and the campaign teams of the individual aspirants for the country's highest office. It will be a great honor for us to speak with delegates you may be able to send.
7,4,8,"Respectfully,"
7,4,9,"From the mountain of the Mexican Southeast, CCRI - CG of the EZLN"
7,5,0,"Regarding the Liberation of Absalón Castellanos Domínguez February 15, 1994"
7,5,1,"To the Mexican and international press: To Mr. Samuel Ruiz García, National Commissioner of Mediation: To Mr. Manuel Camacho Solís, Commissioner for Peace and Reconciliation:"
7,5,2,Gentlemen:
7,5,3,"We, the Clandestine Revolutionary Indigenous Committee of the EZLN, address you once again to say the following:"
7,5,4,"First: In order to expedite the prompt beginning of dialogue for the dignified peace that we all, as Mexicans, want, and as a sign of the sincere willingness of our EZLN, we announce that on Wednesday, February 16, 1994, Division General Absalón Castellanos Domínguez will be freed."
7,5,5,"Second: Division General Absalón Castellanos Domínguez will be handed over to the Commissioner for Peace, Manuel Camacho Solís, and the Commissioner of Mediation, Samuel Ruiz García, in the community of Guadalupe Tepeyac in the township of Las Margaritas, Chiapas. Division General Absalón Castellanos Domínguez's state of health should be examined at the moment of his release by a doctor of the International Red Cross."
7,5,6,"Third: In order to decrease tension in the war zone during the dialogue for peace with dignity, the CCRI - CG of the EZLN announces also its decision to suspend the collection of war taxes in the territories under the control of its troops for the day of February 17, 1994."
7,5,7,"Respectfully,"
7,5,8,From the mountains of Southeast Mexico CCRI - CG of the EZLN
7,6,0,From the Guadalupe Tepeyac Community
7,6,1,"[The following is from a manuscript entitled ""Popular Love in the Chiapaneca Jungle"" (Amor popular de la selva Chiapaneca), read after handing over Absalón Castellanos. The Guadalupe Tepeyac Community is at a hospital built with federal funds, but poorly staffed and stocked.]"
7,6,2,"February 16, 1994"
7,6,3,"To Manuel Camacho Solís, peace envoy, we present the following:"
7,6,4,"In the following we are addressing you with the aim to show you the reality of the zone of the jungle of Chiapas. As a health concern, we would like for the clinic to begin functioning on a normal basis, that it be stocked with medical supplies as soon as possible, and that it be staffed with doctors specializing in different areas."
7,6,5,"Moreover, we still have not received all of the materials because Mr. Salinas de Gortari has provided us with an incomplete clinic, according to its director, Wilfrido Mendoza. He declared to inhabitants of the various communities that the operating room was incomplete, and for this reason no type of surgery is performed. There are also no personnel to take x - rays."
7,6,6,"While it was being built, no one received service, and they were taken to the city of Comitán or to Tuxtla Gutierrez. Also, most of the personnel have no training in curable diseases. Our zone needs doctors who are experts in different curable diseases, since the marginalization, misery and poverty of our communities prevents us from going to the city to seek care. This is why we are asking that the clinic be made functional as soon as possible."
7,6,7,"As far as education goes, we have had no support for many years. Teachers have been divided into two sectors, those who are democratic, and those who are called charro. We want for there to be only one class of teachers and that they be permanent at the place they work instead of working as they have been, no more than a week or three days per month. We also need teaching and construction materials for the development and training of our children as future professionals. We need scholarships for those who want to continue at secondary or preparatory schools and universities."
7,6,8,"Another point is the holding of land. The campesinos do not have fertile land, farm machinery or all the innumerable things needed for production, since it is the latifundistas who get the best land, as well as the machinery, fertilizers, credit and loans."
7,6,9,"The government has paid the most attention to them, while the poor people all over Mexico, who deserve it the most, do not have their support. Nevertheless, they are asking us for the ecological reserve and the mountains, as well as reforestation of the same zone. How can the government not figure out where to exploit wood and other natural resources that are exploited? Those that clearly have no land to survive on, what hope do they have to cultivate anything, if they have nothing?"
