text_id,section_num,para_num,para_str
1,1,0,"[The Mexican Awakener [El Despertador Mexicano] is the newspaper of the EZLN, issued on January 1 in conjunction with the uprising. It was the first document released by the Zapatistas. It contains their Declaration of War, an editorial, and the revolutionary laws.]"
1,1,1,El Despertador Mexicano Declaration of War
1,1,2,[from a photocopy of the original]
1,1,3,"Lacandona Jungle, December 31, 1993"
1,1,4,TODAY WE SAY ENOUGH IS ENOUGH! TO THE PEOPLE OF MEXICO: MEXICAN BROTHERS AND SISTERS:
1,1,5,"We are the product of 500 years of struggle: first against slavery, then during the War of Independence against Spain led by insurgents, then to avoid being absorbed by North American imperialism, then to promulgate our constitution and expel the French Empire from our soil, and later the dictatorship of Porfirio Díaz denied us the just application of the Reform Laws, and the people rebelled and leaders like Villa and Zapata emerged, poor people just like us. We have been denied the most elemental preparation so that they can use us as cannon fodder and pillage the wealth of our country. They don't care that we have nothing, absolutely nothing, not even a roof over our heads: no land, no work, no health care, no food, no education. Nor are we able to freely and democratically elect our political representatives, nor is there independence from foreigners, nor is there peace nor justice for ourselves and our children."
1,1,6,"But today, we say ENOUGH IS ENOUGH. We are the inheritors of the true builders of our nation. The dispossessed, we are millions, and we thereby call upon our brothers and sisters to join this struggle as the only path, so that we will not die of hunger due to the insatiable ambition of a 70 - year dictatorship led by a clique of traitors who represent the most conservative and sell - out groups. They are the same ones who opposed Hidalgo and Morelos, the same ones who betrayed Vincente Guerrero, the same ones who sold half our country to the foreign invader, the same ones who imported a European prince to rule our country, the same ones who formed the ""scientific"" Porfirista dictatorship, the same ones who opposed the Petroleum Expropriation, the same ones who massacred the railroad workers in 1958 and the students in 1968, the same ones who today take everything from us, absolutely everything."
1,1,7,"To prevent the continuation of the above, and as our last hope, after having tried to utilize all legal means based on our Constitution, we go to our Constitution, to apply Article 39, which says:"
1,1,8,"""National Sovereignty essentially and originally resides in the people. All political power emanates from the people and its purpose is to help the people. The people have, at all times, the inalienable right to alter or modify their form of government."""
1,1,9,"Therefore, according to our Constitution, we declare the following to the Mexican Federal Army, the pillar of the Mexican dictatorship that we suffer from, monopolized by a one - party system and led by Carlos Salinas de Gortari, the supreme and illegitimate federal executive who today holds power."
1,1,10,"According to this Declaration of War, we ask that other powers of the nation advocate to restore the legitimacy and the stability of the nation by overthrowing the dictator."
1,1,11,"We also ask that international organizations and the International Red Cross watch over and regulate our battles, so that our efforts are carried out while still protecting our civilian population. We declare now and always that we are subject to the Geneva Accord, forming the EZLN as the fighting arm of our liberation struggle. We have the Mexican people on our side, we have the beloved tri - colored flag, highly respected by our insurgent fighters. We use black and red in our uniform as a symbol of our working people on strike. Our flag carries the following letters, ""EZLN,"" Zapatista National Liberation Army, and we always carry our flag into combat."
1,1,12,"Beforehand, we reject any effort to disgrace our just cause by accusing us of being drug traffickers, drug guerrillas, thieves or other names that might by used by our enemies. Our struggle follows the Constitution, which is held high by its call for justice and equality."
1,1,13,"Therefore, according to this declaration of war, we give our military forces, the EZLN, the following orders:"
1,1,14,"First: Advance to the capital of the country, overcoming the Mexican Federal Army, protecting in our advance the civilian population and permitting the people in the liberated area the right to freely and democratically elect their own administrative authorities."
1,1,15,Second: Respect the lives of our prisoners and turn over all wounded to the International Red Cross.
1,1,16,"Third: Initiate summary judgments against all soldiers of the Mexican Federal Army and the political police who have received training or have been paid by foreigners, accused of being traitors to our country, and against all those who have repressed and treated badly the civilian population, and robbed, or stolen from, or attempted crimes against the good of the people."
1,1,17,"Fourth: Form new troops with all those Mexicans who show their interest in joining our struggle, including those who, being enemy soldiers, turn themselves in without having fought against us, and promise to take orders from the General Command of the EZLN."
1,1,18,Fifth: We ask for the unconditional surrender of the enemy's headquarters before we begin any combat to avoid any loss of lives.
1,1,19,Sixth: Suspend the robbery of our natural resources in the areas controlled by the EZLN.
1,1,20,"To the People of Mexico: We, the men and women, full and free, are conscious that the war that we have declared is our last resort, but also a just one. The dictators have been waging an undeclared genocidal war against our people for many years. Therefore we ask for your participation, your decision to support this plan that struggles for work, land, housing, food, health care, education, independence, freedom, democracy, justice and peace. We declare that we will not stop fighting until the basic demands of our people have been met by forming a government of our country that is free and democratic."
1,1,21,JOIN THE INSURGENT FORCES OF THE ZAPATISTA NATIONAL LIBERATION ARMY!
1,1,22,"General Command of the EZLN December 31, 1993"
1,2,0,Editorial
1,2,1,"Mexicans: workers, campesinos, students, honest professionals, Chicanos, and progressives of other countries: We have begun the struggle that is necessary to meet the demands that never have been met by the Mexican State: work, land, shelter, food, health care, education, independence, freedom, democracy, justice and peace."
1,2,2,"For hundreds of years we have been asking for and believing in promises that were never kept. We were always told to be patient and to wait for better times. They told us to be prudent, that the future would be different. But we see now that this isn't true. Everything is the same or worse now than when our grandparents and parents lived. Our people are still dying from hunger and curable diseases, and live with ignorance, illiteracy and lack of culture. And we realize that if we don't fight, our children can expect the same. And it is not fair."
1,2,3,"Necessity brought us together, and we said ""Enough!"" We no longer have the time or the will to wait for others to solve our problems. We have organized ourselves and we have decided to demand what is ours, taking up arms in the same way that the finest children of the Mexican people have done throughout our history."
1,2,4,"We have entered into combat against the Federal Army and other repressive forces: there are millions of us Mexicans willing to live for our country or die for freedom in this war. This war is necessary for all the poor, exploited and miserable people of Mexico, and we will not stop until we achieve our goals."
1,2,5,"We call on all of you to join our movement because the enemies we face, the rich and the State, are cruel and inhuman. They will put no limit on their bloody instinct to destroy us. It is necessary to struggle on all fronts and from there, with your sympathy, your solidarity, the dissemination that you give our cause, your adoption of the ideals that we are demanding, your incorporation of the Revolution by raising up your people wherever they may be found, these are very important factors in our final triumph."
1,2,6,El Despertador Mexicano is the newspaper of the EZLN. It strives to inform the people about the development of the just war that we have declared against our class enemies.
1,2,7,"In this first issue we present our Declaration of War against the Federal Army, and we publish the orders to be followed by the leaders and officers of the EZLN in our advance through national territory. Also in this issue are the Revolutionary Laws that will be enacted in the liberated territories in order to guarantee their revolutionary control and strengthen the bases so we can begin the process of building a new Mexico. To live for our country or die for freedom."
1,3,0,Revolutionary Laws
1,3,1,Women's Revolutionary Law
1,3,2,"In the just fight for the liberation of our people, the EZLN incorporates women into the revolutionary struggle, regardless of their race, creed, color or political affiliation, requiring only that they share the demands of the exploited people and that they commit to the laws and regulations of the revolution. In addition, taking into account the situation of the woman worker in Mexico, the revolution supports their just demands for equality and justice in the following Women's Revolutionary Law."
1,3,3,"First: Women, regardless of their race, creed, color or political affiliation, have the right to participate in the revolutionary struggle in a way determined by their desire and capacity."
1,3,4,Second: Women have the right to work and receive a just salary.
1,3,5,Third: Women have the right to decide the number of children they will have and care for.
1,3,6,Fourth: Women have the right to participate in the affairs of the community and hold positions of authority if they are freely and democratically elected.
1,3,7,Fifth: Women and their children have the right to primary attention in matters of health and nutrition.
1,3,8,Sixth: Women have the right to education.
1,3,9,"Seventh: Women have the right to choose their partner, and are not to be forced into marriage."
1,3,10,Eighth: Women shall not be beaten or physically mistreated by their family members or by strangers. Rape and attempted rape will be severely punished.
1,3,11,Ninth: Women will be able to occupy positions of leadership in the organization and hold military ranks in the revolutionary armed forces.
1,3,12,Tenth: Women will have all the rights and obligations elaborated in the Revolutionary Laws and regulations.
1,4,0,Urban Reform Law
1,4,1,"In the urban zones controlled by the EZLN, the following laws will be enacted in order to ensure dignified housing for all dispossessed families:"
1,4,2,First: The inhabitants of the zone who own their own homes or apartments will stop paying all taxes.
1,4,3,"Second: The inhabitants of the zone who pay rent, and have resided in the same dwelling for more than 15 years, will stop paying rent to the owner of the property until the revolutionary government triumphs and new legislation is enacted."
1,4,4,"Third: The inhabitants of the zone who pay rent, and have resided in the same dwelling for fewer than 15 years, will pay only 10% of the salary earned by the head of the family as rent, and will not pay at all after having resided in the dwelling for 15 years."
1,4,5,Fourth: Urban lots that already have public services will be opened for immediate occupation in order that dwellings may be constructed on said lots -  - even if the dwellings are only of a provisional nature. The freely and democratically elected authorities will be notified of these occupations.
1,4,6,"Fifth: Vacant public buildings and large mansions will be provisionally occupied by families, who will divide the buildings among themselves. In order to facilitate this, the civil authorities will appoint neighborhood committees that will decide on requests that are presented to them and will grant living space on the basis of need and available resources."
1,5,0,Labor Law: Additions to the Present Law
1,5,1,The following laws will be added to the current Federal Labor Law in the zones controlled by the EZLN.
1,5,2,First: Foreign companies will pay their workers an hourly salary in national money equivalent to what would be payed in dollars outside the country.
1,5,3,"Second: National companies will increase their workers' salaries monthly, by a percentage determined by a local Prices and Salaries Commission. Said Commission will be composed of representatives of the workers, settlers, land -  owners, business people and the freely and democratically elected authorities. The reduction of current salaries will in no way be permitted."
1,5,4,"Third: All workers in the countryside and the cities will receive free medical care in any public or private health center, hospital or clinic. The medical costs will be covered by the employers."
1,5,5,"Fourth: Every worker will have a right to a certain amount of non - transferable stock in the company for which they work, the exact quantity to be determined by the number of years that the worker has worked for the company -  - this in addition to their current pensions. The monetary value of said stock will be used for the worker's retirement, by his wife or by his beneficiary."
1,6,0,Industry and Commerce Law
1,6,1,"First: The prices of basic products will be regulated by a local Prices and Salaries Commission. Said Commission will be composed of workers, settlers, land owners, merchants and the freely and democratically - elected authorities. Increases in the prices of basic products cannot, in any way, be more than increases in salaries."
1,6,2,"Second: The hoarding of any product is prohibited. Hoarders will be detained and turned over to the military authorities, accused of sabotage and treason to the country."
1,6,3,Third: The commerce of a given region should be able to ensure the provision of tortillas and bread for all in time of war.
1,6,4,"Fourth: The industries and businesses that the landowners consider unproductive, and attempt to close in order to carry away the machinery and raw materials, will be passed to the management of the workers, and the machinery will become the property of the nation."
1,7,0,Social Security Law
1,7,1,"First: Abandoned children will be fed and protected by the nearest neighbors under the authority of the EZLN, before being turned over to the civilian authorities, who will protect them until they reach 13 years of age."
1,7,2,Second: Elderly people without family will be protected and will receive priority in housing and the distribution of free food coupons.
1,7,3,Third: Those incapacitated by the war will receive attention and work priority under the direction of the EZLN.
1,7,4,Fourth: The pension of retirees will be equal to the minimum salary established by local Price and Salary Commissions.
1,8,0,Justice Law
1,8,1,"First: All prisoners in all prisons will be liberated, except those guilty of murder, rape and the leaders of drug - trafficking operations."
1,8,2,"Second: All government officials, from the level of the municipal president up to the president of the republic, will be subject to audit, and will be judged for misappropriation of funds in cases where evidence of guilt is found."
1,9,0,Revolutionary Agrarian Law
1,9,1,"The poor campesinos' movement in Mexico demands the return of the land to those who work it and, in the tradition of Emiliano Zapata and in opposition to the reforms to Article 27 of the Mexican Constitution, the EZLN again takes up the just struggle of rural Mexico for land and freedom. With the object of standardizing the new agrarian distribution enacted by the revolution throughout Mexican territory, the following Revolutionary Agrarian Law is issued:"
1,9,2,"First: This law is valid in all Mexican territory, and benefits all poor campesinos and Mexican agricultural laborers regardless of their political affiliation, religious creed, sex, race, or color."
1,9,3,"Second: This law affects all agricultural properties and agro/livestock businesses inside of Mexican territory, whether they are national or foreign - owned."
1,9,4,"Third: All poor - quality land in excess of 100 hectares and all good - quality land in excess of 50 hectares will be subject to the Revolutionary Agrarian Law. The landowners whose lands exceed the aforementioned limits will have the excess taken away from them, and they will be left with the minimum permitted by this law. They may remain as small landholders or join the cooperative campesinos' movement, campesino societies, or communal lands."
1,9,5,"Fourth: Communally held land and the land of popular cooperatives will not be subject to agrarian reform, even though they exceed the limits mentioned in the third article of this law."
1,9,6,"Fifth: The lands affected by this agrarian law will be distributed to the landless campesinos and the agricultural laborers who thus request it as collective property for the formation of cooperatives, campesino societies or agricultural production/livestock collectives. The affected lands should be worked collectively."
1,9,7,"Sixth: The collectives of poor, landless campesinos and agricultural laborers - men, women, and children without land title, or who have land of poor quality - will have the right to be the first to request land."
1,9,8,"Seventh: In order to better cultivate the land for the benefit of the poor campesinos and the agricultural laborers, the expropriation of large estates and agricultural/livestock monopolies will include the expropriation of means of production such as machinery, fertilizer, stores, financial resources, chemical products and technical expertise. All of these means should pass into the hands of the poor campesinos and agricultural laborers, with special attention given to groups organized in cooperatives, collectives and societies."
1,9,9,"Eighth: The groups that benefit from this agrarian law should dedicate themselves to the collective production of necessary foodstuffs for the Mexican people: corn, beans, rice, vegetables and fruit, as well as to the raising of cattle, bees, pigs and horses, and to the production of animal - derived products (meat, milk, eggs, etc.)."
1,9,10,"Ninth: In time of war, a portion of the products of the lands affected by this law will be designated for the sustenance of orphans and widows of revolutionary combatants, and to the support of the revolutionary forces."
1,9,11,"Tenth: The purpose of collective production is primarily to satisfy the people's needs, to instill in those who benefit from this law a consciousness of collective work and benefit, and to create production, defense and mutual - aid units in the Mexican countryside. When a region doesn't produce some product, it will trade justly and equally with another region where it is produced. Excess production can be exported to other countries if there is no national demand for the product."
1,9,12,"Eleventh: Large agricultural businesses will be expropriated and passed to the hands of the Mexican people, and will be administered collectively by the workers of those businesses. The cultivation machinery, seeds, etc. that are sitting idle in factories and businesses will be distributed among rural collectives, with the objective of making the land fertile and ending the hunger of the people."
1,9,13,Twelfth: Individual hoarding of land and the means of production will not be permitted.
1,9,14,Thirteenth: Zones of virgin jungle and forest will be preserved. There will be reforestation campaigns in the principal zones.
1,9,15,"Fourteenth: The riverheads, rivers, lakes and oceans are the collective property of the Mexican people, and they will be cared for by not polluting them and by punishing their misuse."
1,9,16,"Fifteenth: In order to benefit the poor, landless campesinos and agricultural workers, in addition to the agrarian redistribution established by this law, commercial centers will be created to buy the campesinos' products at a fair price and to sell to them, at a fair price, goods that the campesino needs for a dignified life. Also, community health centers will be created with every benefit of modern medicine, with capable and conscientious doctors and nurses, and with free medical care for the people. Recreation centers will be created for the campesinos and their families so that they may rest in dignity without the need for bars or bordellos. Educational centers and free schools will be created where the campesinos and their families can receive an education, regardless of their age, sex, race or political affiliation, and where they can learn the techniques necessary for their development. Housing and road construction centers will be established with engineers, architects, and the necessary materials for the campesinos' dignified housing and the construction of good roads for transportation. Service centers will be created in order to guarantee potable water, drainage, electricity, radio and television, in addition to everything necessary for housework: stoves, refrigerators, lavatories, mills, etc."
1,9,17,"Sixteenth: The campesinos who work collectively will not be taxed. Nor will the ejidos, cooperatives or communal lands be taxed. From the moment that this Revolutionary Agrarian Law is implemented, all debts -  - whether they are from credit, taxes, or loans -  - that are owed by the poor campesinos or agricultural workers to the oppressive government, to foreigners or to capitalists, are forgiven."
1,10,0,Law of Rights and Obligations of Peoples in Struggle
1,10,1,"In its liberatory advance through Mexican territory, and in the struggle against the government and against the large national and foreign exploiters, the EZLN will implement, with the help of the people engaged in struggle, the following Law of Rights and Obligations of Peoples in Struggle:"
1,10,2,"First: The peoples in struggle against the oppressor government and the large national and foreign exploiters, without regard to their political affiliation, religious creed, race or color, will have the following rights:"
1,10,3,"A: To choose, freely and democratically, the authorities of whatever type they consider convenient, and to demand that they be respected."
1,10,4,"B: To demand that the revolutionary armed forces not intervene in matters of civil order or the disposition of capital relating to agriculture, commerce, finances, and industry, as these are the exclusive domain of the civil authorities, elected freely and democratically."
1,10,5,"C: To organize and exercise armed defense of their collective and private goods, as well as to organize and exercise the vigilance of public order and good government according to the popular will."
1,10,6,"D: To demand that the revolutionary armed forces guarantee the safety of people, families and private and collective property of neighbors or transients, when these people are not enemies of the revolution."
1,10,7,"E: The inhabitants of every population have the right to acquire and possess arms to defend their persons, families and property, according to the laws of disposition of capital of farms, commerce, finance and industry, against the armed attacks committed by the revolutionary forces or those of the government. By the same token, they are fully authorized to make use of those arms against whatever person or group of people assaults their homes, the honor of their families, or attempt to commit robberies or attacks of whatever form against their persons. This is valid only for those who are not enemies of the revolution."
1,10,8,"Second: The civil authorities of whatever type, who are elected democratically, will have, in addition to the previous rights and the attributions that are signalled by the respective revolutionary laws, the following rights:"
1,10,9,"A: They will be able to imprison, disarm and turn in to the Commands anyone they find robbing, raiding or looting any home or committing any other violation, for which they will receive their deserved punishment, even if they are a member of the revolutionary armed forces. The same procedures will be employed against those who commit any violation, even if they are not caught in the act, if their guilt is sufficiently demonstrated."
1,10,10,"B: They will have the right that, for their conduct, revolutionary taxes be imposed as established by the War Tax Law."
1,10,11,"Third: Peoples in struggle against the oppressor government and the great national and foreign exploiters, without regard to their political affiliation, religious creed, race or color, will have the following obligations:"
1,10,12,"A: To give their services in works of vigilance, according to majority will or the military necessities of revolutionary war."
1,10,13,"B: To respond to calls for help made by the democratically elected authorities, the revolutionary armed forces or by any revolutionary military person in cases of urgency, to combat the enemy."
1,10,14,C: To lend their services as mail deliverers or guides to the revolutionary armed forces.
1,10,15,D: To lend their services to carry food to the revolutionary troops when they are combatting the enemy.
1,10,16,"E: To lend their services to transport wounded, bury cadavers or other similar works tied to the cause and interests of the revolution."
1,10,17,"F: To give food and lodging to the revolutionary forces that are guarding or passing through the respective populations, to the degree that they are able."
