text_id,section_num,para_num,para_str
3,11,12,"When one military - political force (such as the Mexican federal government) asks another military - political force (such as the EZLN) to turn in its arms, that means, in political and military terms, that they seek an unconditional surrender. In exchange for that unconditional surrender, the government offers the usual: an audit of internal accounts, a packet of declarations, promises and more bureaucratic dependencies."
3,11,13,"Concretely, the request to ""put down arms"" is the one that provokes the greatest suspicions. National and Latin American history teaches us that those who turn in their arms, trusting the forgetfulness of those who pursue them, end their days riddled with bullet holes in any place by any death squad of any political or governing faction. What reason do we have to think that it would not happen like this in our country?"
3,11,14,"We think that revolutionary change in Mexico will not be a product of action in just one direction. In other words, it will not be, in the strict sense, an armed revolution or a peaceful revolution. It will primordially be a revolution that is the result of struggle on various social fronts, with many methods, under many social forms, with varying degrees of commitment and participation. And the result will be, not one of a party, organization, or coalition of organizations with its triumphant specific social proposal, but a sort of democratic space for the resolution of confrontation between diverse political proposals. This democratic space of resolution will have three fundamental premises that are inseparable, already, historically: democracy in deciding the dominant social proposal, freedom to subscribe to one or another proposal, and the justice to which all proposals will have to adhere. The revolutionary change in Mexico will not follow a strict calendar. It could be the hurricane that explodes after it accumulates for a while, or a series of social battles that, step by step, will overcome the forces that oppose it. The revolutionary change in Mexico will not be under one leadership, with one homogenous membership and one leader to guide it, but with a plurality of dominant forces that change, but turn around one common point: the trio of democracy, freedom, and justice upon which the new Mexico will be built, or it won't be built."
3,11,15,"Social peace will only happen if it is just and dignified for all. The dialogue process for peace comes from a fundamental determination, not from a political initiative of the federal government, not from a political - military strength (that for the majority continues to be a mystery) but from a firm action of what they call Mexican civil society. From the same Mexican civil society and not from the will of the government or from the strength of our weapons, will come the possibility of a real democratic change in Mexico."
3,11,16,"Epilogue: ""About ski masks and other face masks"""
3,11,17,"Why all the scandal about the ski mask? Isn't the Mexican political culture a ""culture of the coverings?"" But, to end the growing agony of some who fear (or wish) that some ""Kamarrada"" or Boggie el Aceitoso is the one who, in the end, is behind the ski mask and the ""pronounced nose"" (as La Jornada calls it) of the ""Sup"" (as the compan~eros call me) I propose the following: I am willing to take off the ski mask if Mexican society takes off the mask that the anxieties of foreign vocations have already been imposing for many years. What would happen? The predictable: Mexican civil society (excluding the Zapatistas, because they know it perfectly well in image, thought and, deed) would realize, not without disillusionment, that the ""Sup Marcos"" is not a foreigner and that he is not as handsome as was promoted by the ""personal record in the Attorney General's Office (Procuradora General de la Republica, PGR). But not only that, by taking off its own mask, Mexican civil society will realize, with a stronger impact, that the image that it has sold itself is a forgery, and that reality is far more terrifying than it thought. Each of us will show our faces, but the big difference will be that the ""Sup Marcos"" has always known what his real face looked like, and civil society will just wake up from a long and tired sleep that ""modernity"" has imposed at the cost of everything and everyone. The ""Sup Marcos"" is ready to take off the ski mask. Is Mexican civil society ready to take off its mask? Don't miss the next episode of this story of masks and faces that reaffirm and deny themselves (if the airplanes, helicopters, and olive - drab green masks allow it)."
3,11,18,"That is all...but there is not much missing. Well, this may be the end of a very short epistolary exchange between a ski mask of a pronounced nose and some of the best of the honest Mexican press."
3,11,19,"Health and no hug now because it could awaken jealousy and suspicion,"
3,11,20,Subcommander Marcos
3,12,0,On Misunderstandings about the EZLN and the Real First Uprising
3,12,1,"January 26, 1994"
3,12,2,"To national newspaper La Jornada: To the local newspaper from San Cristóbal de las Casas, Chiapas, Tiempo:"
3,12,3,"Mr. Álvaro Cepeda Neri ""Conjetura"" column, national newspaper La Jornada, Mexico City"
3,12,4,Mr. Cepeda Neri and family:
3,12,5,"I confirm receiving your letter, published in La Jornada, dated January 24, 1994. We thank you for your thoughts. We are doing well here. Helicopters and airplanes come and go, they get close, they see us, we see them, they leave, they come back, and so on, day and night. The mountain protects us, the mountain has been our compan~era for many years."
3,12,6,"I would like to talk to you about some things that happened around this land and that, for sure, will not appear in the newspapers and magazines, because everyday happenings are of no interest to them. And there is, believe me, a daily heroism that makes sparkles that from time to time light the seeming mediocrity of our country's history. A few hours ago I met with some members of the CCRI. They discussed the way they will name the members of the delegation to the dialogue with the commissioner for peace and reconciliation in Chiapas. After that, they went over some newspapers that arrived (late, of course). The journalists' notes and comments provoked diverse reactions in all of us."
3,12,7,"Javier, a slow - spoken Tzotzil, who looks for words that tell the truth, has read now what happened in the state of Tlalmanalco. Indignant, he comes to me and tells me ""We have to invite those people to come here with us."" I start to explain to him that we can't invite them, because they are a political party and we can't intervene in the thinking of other political organizations, because that place is too far away, because they will be stopped at the Army checkpoints, because the beans won't be enough for so many, because re - etcetera, etc. Javier waits patiently until I finish speaking. He now tells me, in a very serious tone: ""I don't mean the PRD,"" and adds, ""I mean the police officers who beat them."" Squatting, he decrees, sentences, and orders: ""Invite those police officers to come here. Tell them that if they are real men they should come here and fight against us. To see if it is the same to beat peaceful, innocent people as to fight us. Tell them to write so that we can teach them to respect the humble people."""
3,12,8,"Javier, still squatting in front of me, waits for me to start writing the letter to the cops of the state of Mexico. I wonder...in that moment the guard announces that some reporters are coming in and that they want to talk to someone. I excuse myself to Javier, I go to see who is going to go speak with the journalists. The letter of invitation to police officers is left pending."
3,12,9,"Now there's Angel, a Tzeltal, whose pride is to have read the complete book by Womack on Zapata (""It took me three years. I struggled, but I finished it,"" he says every time someone questions this feat). He comes to me with a newspaper in his left hand (he has an M - 1 rifle in the right). ""I can't understand a world this man says,"" he complains to me. ""He uses hard words and he doesn't know where he's going. He seems to understand our struggle, and then he seems to not understand our struggle."" I look at the newspaper and Angel points out the editorial by ""X."" I explain to Javier what that man is saying, that it is true that there is poverty in Chiapas, but that it is not possible for the Indigenous people to have organized so well and to have risen up with a plan, that the Indigenous people always rise up without a plan, just like that, all of a sudden. That means that there are strange and foreign people taking advantage of the Indigenous poverty to give a bad image of Mexico and its president, that the EZLN is among the Indigenous but does not represent them. Angel starts to turn around and around. Furious, he can't speak clearly, he hurriedly mixes words in dialect and Spanish. ""Why do they always think of us as little children?"" He throws the question to my face. I almost dropped the half - uncooked rice some novice cook has prepared ""specially for the Sup."" He keeps going, more calmly after he gets his own rice. ""Why is it that, for them, we can't think on our own and have clear thinking with a good plan and a good struggle?"" I understand that the question is not for me. Angel understands well that the question is for the improbable man of the ""deep article."" We both, Angel and I, know that this and other questions will receive no answer. Is it, perhaps, that intelligence only reaches the head of the ladino? Is it that our grandfathers did not think well when they were alive?"" Angel asks and asks. Nobody answers, nobody will..."
3,12,10,"Susana, a Tzotzil, is upset. A while ago they were making fun of her because, according to the rest of the CCRI, the first uprising of the EZLN, in March, 1993, was her fault. ""I am angry,"" she tells me. I, while I find out what is going on, seek protection behind a rock. ""The compan~eros say that it is my fault that the Zapatistas rose up last year."" I start to approach carefully. After a while I discover what is going on: In March of 1993 the compan~eros debated about what would later be the ""Revolutionary Laws."" Susana was in charge of going around to dozens of communities to speak with groups of women and put together, from her thoughts, the ""Women's Laws"". When the CCRI got together to vote on the laws, each one of the commissions got up: Justice, Agrarian Reform, War Taxes, Rights and Obligations of Reople in Struggle, and Women. Susana had to read the proposals that she had gotten together from the thoughts of thousands of Indigenous women. She started to read and, as she read on, the assembly of the CCRI became more and more restless. You could hear murmurs and comments. In Chol, Tzotzil, Tojolobal, Mam, Zoque and Spanish. The comments jumped from one side to the other. Susana, undisturbed, charged on against everyone and everything: ""We don't want to be forced into marriage with someone we don't want. We want to have the children we want and can take care of. We want the right to hold rank in the community. We want the right to speak up and to be respected. We want the right to study and even be drivers."" And she kept going like that until she was done. At the end there was a strong silence. The ""Women's Laws"" that Susana had just read meant a true revolution for the Indigenous communities. The women responsible were receiving the translation in their dialects of what Susana had said. The men looked at each other nervously, restless. All of a sudden all the translators ended almost at the same time. And, in a single movement, the compan~eras responsible for the laws started to clap and talk among themselves. Needless to say, the ""Women's Laws"" were approved unanimously. A Tzeltal responsible for the law commented: ""The good thing is that my wife doesn't understand Spanish, because otherwise..."" An insurgent official who was a woman and a high infantry rank, jumped on him: ""You're fucked, because we are going to translate it into all the dialects."" The compan~ero looked down. The women responsible were singing, the men were scratching their heads. I, cautiously, called a recess. This story that now, according to Susana, started when someone from the CCRI read a newspaper that points to the proof that the EZLN is not truly Indigenous being that Indigenous people could not have agreed to rise up on January 1. Someone, as a joke, said that this was not the first uprising, that the first was March, 1993. They joked with Susana and she left with a sharp ""Fuck you"" and something else in Tzotzil that nobody tried to translate. That was the truth: The first EZLN uprising was March, 1993 and was lead by the Zapatista women. There were no casualties, and they won. Things of this land."
3,12,11,"At midnight Pedro, a Chol with a big mustache, comes closer to me with a candle in his right hand. He sits next to me. He looks at me with his round black eyes and says nothing. ""We have to go to Mexico [City],"" he says to me and to himself. I start to scratch my head, thinking of the orders that will be given to start the march, the routes we will follow, the casualties we will have, coming to the city lights again, the asphalt of the roads."
3,12,12,"Pedro interrupts me: ""Mexicans say Chiapas is different from other places, that here things are bad, but they are good elsewhere in Mexico."" Now I look at him; he doesn't return the look, but hands me a newspaper. I look for my lamp and start to read the article that Pedro points out to me. It says that our struggle is destined to fail because it is not national and it is not rational, because our demands are local, Indigenous. ""That person's thinking is poor,"" says Pedro, ""even poorer than we are because we want not only justice, but also freedom and democracy. And this man thinks that he is not poor even when he can't truly elect a government. He feels sorry for us. Poor little things."" The candle burns between us. Pedro understands, I understand, the night understands... ""Mexicans don't understand. We have to go to Mexico [City],"" says Pedro while he leaves, taking the candle in his right hand. The cold is hard in the morning. The guard screams: ""Halt! Who goes?"" ""The country!"" another voice responds, and something warm reaches us."
3,12,13,"Well Mr. Cepeda Neri, I wanted to take advantage of this letter to tell you these and other things, but that is all for now. We hope that you and your family are in good health. Until next time, which is improbable."
3,12,14,"Health and respect to you and those who are with you,"
3,12,15,"From the mountains of the Mexican Southeast, Insurgent Subcommander Marcos"
3,12,16,"P.S.: Javier just reached me happily to ask if this is the letter to invite the police officers of the state of Mexico. I tell him that it is not, that it is for a journalist. ""Ah,"" he says disappointed. But he adds sharply: ""Tell them to not forget us, that our truth is for them as well."" All right."
3,13,0,An Invitation to Members of the Press to Attend the Dialogue
3,13,1,"[La Jornada, 2/2] Mexico, January 29, 1994"
3,13,2,To the national and international press:
3,13,3,Gentlemen:
3,13,4,The Clandestine Revolutionary Indigenous Committee - General Command of the EZLN respectfully addresses itself to you to put forth the following:
3,13,5,"First: As is publicly known, the beginning of the dialogue for peace between the EZLN and the federal government, whose time and place have yet to be decided, is imminent. There are already fundamental agreements between this CCRI - CG of the EZLN and the commissioner for peace and reconciliation in Chiapas. There remain a few details to be finalized and a few previous agreements to be fulfilled, but the basic elements are decided."
3,13,6,"Second: We know that your work is to report to the Mexican people and to the world about what happens in this stage of the just war of our EZLN against oppression, injustice and lies."
3,13,7,"Third: There exist some informational media that have fully declined to report with objectivity what has happened in our state. Various media have specifically preached against our cause and the cause of the Chiapaneco Indigenous people. We have never asked any news media to become ""spokespeople"" for the EZLN, but we consider objective reporting to be your duty, and the right of the whole society."
3,13,8,"Fourth: On the part of the CCRI - CG of the EZLN there is an open - door policy for all news media that, in our opinion, carry out their jobs objectively, without taking part on one side or the other."
3,13,9,"Fifth: Therefore the CCRI - CG of the EZLN declares that all print media, regardless of political or party affiliation or ideological orientation, can, as far as the EZLN is concerned, cover the event of the Dialogue for Peace and Reconciliation. As for the television media, the EZLN would only veto the attendance of the national private television networks of Televisa and Televisión Azteca. The first because they do not need to look for news since they invent it and make it up to their taste and convenience. The second because their reporters have demonstrated a lack of professionalism by offering money to our combatants so that they would make statements. The rest of the national and foreign television media will be approved without any problems with the EZLN."
3,13,10,"Sixth: The approval by the EZLN of whatever print media will be done by way of the National Commissioner for Mediation, Mr. Samuel Ruiz García, at the time and place that he finds appropriate."
3,13,11,Seventh: The EZLN wants to make a special invitation to the following news media:
3,13,12,"A) Newspapers: La Jornada, El Financiero, Tiempo (of San Cristóbal de las Casas), The New York Times, The Washington Post, Los Angeles Times, Le Monde, Houston Chronicle."
3,13,13,"B) Magazines and news weeklies: Proceso, Siempre, Mira."
3,13,14,"C) Television: July 6 Channel, Multivisión, Channel 11, CNN."
3,13,15,"D) News Agencies: AP, UPI, AFP, Reuters, Prensa Latina."
3,13,16,"E) Radio stations: Radio Educación WM (of San Cristóbal de las Casas), Xeva (of Tabasco), Radio Red, Grupo Acir."
3,13,17,"Eighth: The EZLN declares that, if it is at all possible, the reporters specially mentioned above attend."
3,13,18,Ninth: The EZLN reserves the right to give interviews or statements to any of the news media that approach them.
3,13,19,"Respectfully,"
3,13,20,"From the Mountains of the Mexican Southeast, Clandestine Revolutionary Indigenous Committee -  General Command of the Zapatista National Liberation Army"
4,1,0,Letters from the CCRI - CG to Various Organizations
4,1,1,[The following is a series of letters that the CCRI - CG wrote to various organizations expressing and asking for solidarity.]
4,1,2,A Letter of Introduction
4,1,3,"February 2, 1994"
4,1,4,"To the national weekly Proceso: To the national newspaper El Financiero: To the national newspaper La Jornada: To the local newspaper of San Cristóbal de las Casas, Chiapas, Tiempo:"
4,1,5,Gentlemen:
4,1,6,"Here I send you a series of letters sent from the CCRI - CG of the EZLN to various destinations. I hope that you have space, if not to publish them as soon as possible, to comment on them or see that they reach their destinations."
4,1,7,"For now, that is all. We wait patiently for that plane which flies over us to run out of gas and fall. Opinions are divided in terms of whether, when it falls, we will eat it roasted or boiled. The more detail - oriented recommend a marinade. The sanitation service warns us of the risk of indigestion from excessive aluminum. Anyway, salt is the only thing we have too much of. Would you like a taste in any case? (They say aluminum keeps well)."
4,1,8,"Indigestionally (which is not to say that now I do not send health, obviously),"
4,1,9,"From the mountains of the Mexican Southeast, Insurgent Subcommander Marcos"
4,1,10,"P.S.: How is it going anonymous? Pretty, isn't it?"
4,2,0,To the Council of 500 Years of Indigenous Resistance
4,2,1,"February 1, 1994"
4,2,2,Zapatistas: valor came from our dead elders
4,2,3,"To The Guerrero Council of 500 Years of Indigenous Resistance, A.C. (Consejo Guerrense 500 An~os de Resistencia Indígena, A.C.) Chilpancingo, Guerrero, Mexico:"
4,2,4,Brothers and Sisters:
4,2,5,"We want to tell you that we received the letter that you sent January 24, 1994. We are very happy to know that our Indigenous brothers and sisters, Amuzgos, Náhuatls and Tlapanecos, understand our just struggle for dignity and freedom for the Indians and for all Mexicans."
4,2,6,"Our heart is strengthened by your words, which came from so far away, which come from the entire history of our oppression, death and misery that the evil officials have dictated for our communities and our peoples. Our heart is made large by your message, which comes to us leaping over mountains, rivers, cities, countries, distrust, and discrimination."
4,2,7,"In our name, in your name, in the name of all of the Indians of Mexico, in the name of all Indigenous and non - Indigenous Mexicans, in the name of all good people of good paths, we receive your words, brothers and sisters, brothers and sisters yesterday in exploitation and misery, bothers and sisters today and tomorrow in the dignified and true struggle."
4,2,8,Today we mark a month since the first time the Zapatista light brightened the night of our peoples.
4,2,9,"In our heart there was so much pain, our death and misery were so much, and nothing would change, bothers and sisters, in this world in which our grandparents told us to keep living and struggling. Our pain and suffering was so much that it no longer fit in the hearts of some, and it started overflowing, and went filling other hearts with pain and suffering, and the hearts of the young men and women filled, valiant all of them, and the hearts of the children filled, down to the smallest of them, and the hearts of animals and plants filled, and the hearts of the stones filled and all of our world filled with suffering and pain, and the wind and the sun were pained and suffered, and the earth had pain and suffering. Everything was pain and suffering, everything was silence."
4,2,10,"Then this pain united us and made us talk, and we recognized that in our words there was truth. We knew that it was not just pain and suffering inhabiting our tongue. We knew that there was still hope in our breasts. We talked with each other. We looked within ourselves and we looked at our history. We saw our elder parents suffer and struggle. We saw our grandparents struggle. We saw our parents with fury in their hands. We saw that everything had not been taken away from us, that we had something more valiant, which made us live, which made our path go over plants and animals, which made the rock be under our feet, and we saw, brothers and sisters, that it was DIGNITY that was all that we had, and we saw that it was a great shame to have forgotten this, and we saw that DIGNITY was good for men to be once again men, and dignity returned to inhabit our heart, and we were new still, and the dead, our dead, saw that we were new still, and they called us again, to dignity, to struggle."
4,2,11,"And then there was no longer only pain and suffering in our heart. Courage arrived, valor came to us from the mouths of our elders, already dead but living again in the dignity that they gave us. And we saw then that it is bad to die with suffering and pain. We saw that it is bad to die without struggling, and we saw that we have to win a dignified death so that all can live well one day. Then our hands looked for freedom and justice. Then our hands, empty of hope, filled with fire to ask and shout our anguish, our struggle. Then we rose up to walk again. Our step became firm again. Our hands and hearts were armed. ""For all!"" says our heart, not only for some, not for the few. ""For all!"" says our step. ""For all!"" shouts our spilt blood, coloring the streets of the cities where lies and plundering rule."
4,2,12,"We left behind our lands. Our houses are far away. We all left everything. We took off skin to dress for war and death. To live, we die. Nothing for us, everything for everyone, what is ours and of our children. We leave everything."
4,2,13,"Now they want to keep us alone, brothers and sisters. They want our death to be meaningless. They want our blood to be forgotten between the stones and the dung. They want our voice to be silenced. They want our step to be once again far away."
4,2,14,"Do not abandon us, brothers and sisters. Take our blood as sustenance. Fill your hearts, and the hearts of all good men of these lands, Indigenous and non - Indigenous, men and women, elders and children. Do not leave us alone. Let it not all be in vain."
4,2,15,The voice of the blood that united us when the land and the sky were not the property of great masters calls us again. May our hearts join their steps. May the powerful tremble. May the heart of the small and the miserable be happy. May the dead always have life.
4,2,16,Do not abandon us. Do not let us die alone. Do not leave our struggle in the vacuum of the powerful.
4,2,17,"Brothers and sisters, may our path be the same for all: freedom, democracy, justice."
4,2,18,"Respectfully,"
4,2,19,"From the mountains of the Mexican Southeast, CCRI - CG of the EZLN"
4,3,0,To the Non - Governmental Organizations
4,3,1,"February 1, 1994"
4,3,2,To all Non - Government Organizations in Mexico:
4,3,3,Gentlemen:
4,3,4,The CCRI - CG of the EZLN respectfully addresses all of you to make the following request:
