text_id,section_num,para_num,para_str
11,6,22,"Postscript for the PRD - About the logic of the dead: The compan~eros read what you wrote about ""having had more casualties than the EZLN,"" and immediately they started to count up the casualties. They added and multiplied the casualties starting from more than 10 years ago when we began to lay ambushes along the footpaths and roads ""against bandits."" The compan~eros say that when it comes to counting the dead, nobody beats them. ""We are well trained in this,"" says Gabino. The discussions among the different ""tendencies"" in the EZLN have become more heated: The most radical compan~eros want to start counting from when the Spanish began their violent advance toward the jungle and the mountains, but the more discreet and prudent compan~eros want to start counting from when we formed the EZLN. Some ask whether we should count those who have died during the 136 days that the military has had us surrounded. They ask if we should count Amalia, 25 years old and with seven children. She began to become ""a little ill"" at 6 p.m. on day 125 of the military blockade. Then began the fever, the diarrhea, the vomiting, and the bleeding between her legs, and at midnight we were asked for an ambulance. The ambulance said that it couldn't make it, and at 4 in the morning we managed to get some gasoline and we went to get her in a three - ton truck. One hundred meters from the medical compound, where Lieutenant Elena was, she said, ""I'm going to die."" And she did die, 98 meters from the medical compound and Lieutenant Elena, the life and blood flowing out from between her legs. When I asked if she was dead, Lieutenant Elena said yes, she died ""at once."" The morning of day 126 of the military blockade, Amalia's second daughter looked upon the body of her mother on the stretcher and told her father that she was going to ask the neighbors for some stew, ""because mother can't make it anymore."" The compan~eros ask if they should count Ibarra's daughter, who died ""as if she had become bored with coughing."" Everyone is counting up the dead. Some are using a calculator taken from the town hall in Ocosingo. They are still doing this when Juana comes to ask them to count old Antonio, ""who died of sorrow."" Later Lorenzo comes and asks them to count his son Lorenzo, ""who died during the night."" By radio they transmit the names of dead men and women. Soon people stop and take out their calculators or pencils, and they look at each other. They're confused; they don't know whether they're adding...or subtracting. Of pontificators. Magnificent self - criticism is always opportunistic."
11,6,23,"Finally, you might accuse us of not taking into account the scale of the different political forces, you might accuse us of political clumsiness, of not having a satellite [dish] so that we could view the debate ourselves, of not having subscriptions to the principal newspapers and magazines so we could read the post - debate analysis. You might accuse us of not being friendly, of being discourteous, of not recognizing possible allies, of being sectarians."
11,6,24,All right. Remember that all we have done is get hope started. We wish you health and hope that you leave the animosity for the lazy fools.
11,6,25,"A hug from this side of of the military blockade,"
11,6,26,"The impertinent subcommander, just like a tornado."
12,1,0,Early Results of the Consultations
12,1,1,"[from a photocopy of the original, signed communique received via the Nicaragua Solidarity Network] June 1, 1994"
12,1,2,To the national news weekly Proceso: To the national newspaper La Jornada: To the national newspaper El Financiero: To the local newspaper of San Cristóbal de las Casas Tiempo:
12,1,3,Gentlemen:
12,1,4,"The following communicates to you the early results of the consultations. The wind and the gray already inhabit their June, some shreds of May will come for several of its days. The wind, the real captain of the world, rules again in these lands. We, as is appropriate, obey it."
12,1,5,"The jump from the fifth to the sixth month was with memorable rain and wind. I did not know it, and now I read it. It was Juntacadáveres [gather cadavers] coming through for the last time..."
12,1,6,"From the mountains of the Mexican Southeast, Insurgent Subcommander Marcos June of 1994"
12,1,7,"P.S. of Torricelli [US Senator (D, NJ) who went to Chiapas but was denied meetings with the EZLN and other campesino groups]: We discussed whether we were going to receive him or not. What happened is that the ""tendencies"" in the EZLN faced off again: Some said that we should receive him and we could trade him for an aircraft carrier (to carry those water cannons in the anti - riot trucks). Others said that he could remain captive and that Lieutenant Serapio could have dart competitions with him to see how many dollars he could get out of him (this tendency was defeated almost immediately when we wondered in what exchange bureau we could change the dollars). Some others said that he could stop by and we could detain him for a few years (let's say 30) so that he could see what it feels like to be surrounded (or blockaded, as the case may be: ""it is not the same thing, but it's the same."") The minority said that he should stay and, when the airplane fell, he should be the first to taste the hard aluminum, to make sure that it is not poisoned. The discussion was at the tastiest part (in other words, when they were serving the meal), but then, after lighting my pipe, the lit match fell on the two pieces of fax paper and, in the face of the flame, the enthusiasm spread; they brought tostadas to heat up, stale cookies and a guitar. They started to sing, and of course, to dance. The ""tendencies"" were diluted in the dance of a cumbia, and the first drops of the first rains put out the embers... So went the 133rd night of the encirclement, and the moon was a red and large hole in the wounded nighttime of May. I set myself to one side. That was the last dry match..."
12,1,8,"P.S. of ""THE OTHER CONSULTATION"": I have looked over the portion of the external correspondence addressed to my ski mask. There is everything: drawings, famous people (of the mind and others), death threats, and challenges to duels. These are the preliminary results:"
12,1,9,"-  - 97.98% of those consulted think I am a big fool. 2% think I am not a fool, but a clown. 0.02% did not answer (they were telling a pepito joke)."
12,1,10,-  - 87.56% think that I will end up selling myself to the government. 12% asked the price. 0.44% looked in their wallets for change.
12,1,11,"-  - 74.38% say that I don't write the letters and communique's, and that with this face, they doubt I could put together a pair of coherent ideas. 25% indicate that I do write them, but that they are dictated to me. 0.62% preferred to read ""el chahuistle."""
12,1,12,"-  - 69.69% say what they say. The rest don't say it but think it. Several did not answer, but turned their eyes away and sighed noticeably."
12,1,13,"-  - 53.45% say that I have never been in the mountains and that I send things out from a public desk where theses and letters are typewritten [untranslatable word play follows here]; 46% said that I had been in the mountains, but those of Vail, Colorado, Iuesei [Spanish phonetic for USA]. 0.55% are lining up for the ticket to the roller coaster."
12,1,14,"-  - 49.99% say that I have never picked up a weapon, and that I am ""a desk soldier."" 50% say that the only weapon that I have picked up is the one god gave me, and who knows about that, they say. 0.01% maintained a prudent distance. (Hey! Don't splash!)"
12,1,15,"-  - 33.71% say that ""I lost ground"" with the criticism of the PRD and the veto of ""important newspapers""(?) . 66% say that I never had any ground at all, and that they would surely evict me. 0.29% did not bring their land tax ticket."
12,1,16,"-  - 26% said that my ski mask was too loose, and that it showed EVERYTHING. 73% told me to close my zipper. 0.38% went to get their binoculars."
12,1,17,-  - 13.64% said I am egocentric. 86% said I am very vain. 0.36% switched newspapers and now read Nexus.
12,1,18,"-  - 99.99999% say to hell with meetings and consultations. 0.00001% went to the bathroom and are coming back (note: They took the consultation sheet, don't leave with it)."
12,1,19,"Well, that is how things are going. To stop the adverse tendencies I need to support the ""serious"" work that they are doing, such as the polls rating the popularity of Zedillo, or a voter register which they will use in August, or a carousel with the most loyal troops. Benito says that instead of tamales we can try ""operation tostada."" Mario cuts shells and says that ""the crazy rat"" is not necessary, that he will take charge of purifying the voter register. Pure modernity, then."
12,1,20,"All right. Health, and (please) advice for the downfall of this system of computation. (Hurry! The Committee threatens with an ""ad hoc"" consultation on the sup - consultations.)"
12,1,21,"From some sup - electoral laboratory in the Mexican Southeast,"
12,1,22,"Subcommander Marcos The sup, trying some alchemy to resuscitate even dinosaurs."
12,2,0,On Groups Claiming Connection to the EZLN
12,2,1,"[La Jornada] June 3, 1994"
12,2,2,To the people of Mexico: To the peoples and governments of the world:
12,2,3,Brothers:
12,2,4,The Clandestine Revolutionary Indigenous Committee - General Command of the EZLN addresses itself to you in order to declare the following:
12,2,5,"First: It has come to our attention that people who say that they are members of the organization Revolutionary Workers Clandestine Party - Union of the People (Partido Revolucionario Obrero Clandestino - Unión del Pueblo, PROCUP) have declared in certain places in the United States that PROCUP has links with the Zapatista National Liberation Army, and that the EZLN is the ""armed wing"" of PROCUP. These people have gathered funds implying that ""they are for the EZLN."""
12,2,6,"Second: The Zapatista National Liberation Army declares that it has absolutely no relationship or link with the PROCUP. The EZLN has never had any contact with PROCUP, it is not part of PROCUP's structure, it does not have anything to do with PROCUP. The funds gathered by PROCUP were in no way gathered for the EZLN."
12,2,7,"Third: In several townships in the state of Chiapas, members of the organization called Workers Party (Partido del Trabajo, PT) have tried to convince the campesinos to vote for them in the upcoming elections in August by saying that the PT is in contact with the EZLN and that ""they have an agreement from Insurgent Subcommander Marcos,"" to support the PT in August."
12,2,8,"Fourth: The Zapatista National Liberation Army declares that it has absolutely no relationship or pact with the PT. Leaders of the PT have never met with Insurgent Subcommander Marcos, nor with members of the Clandestine Revolutionary Indigenous Committee of the EZLN. We do not support the PT in the upcoming elections in August."
12,2,9,"Fifth: We urge these different organizations not to use the EZLN's name for their benefit, and we ask them not to lie about supposed relationships that they do not have with the EZLN."
12,2,10,"Sixth: We call on the Mexican people and on the peoples of the world to not let themselves be deceived. When the EZLN has contact or a pact with an organization, we will let it be known publicly in a communique', as we have done before with CEOIC and Conac - LN."
12,2,11,Democracy! Freedom! Justice!
12,2,12,"Respectfully,"
12,2,13,Clandestine Revolutionary Indigenous Committee -  General Command of the Zapatista National Liberation Army Mexico
12,3,0,First Communique' on the Results of the Consultations
12,3,1,"[La Jornada] June 3, 1994"
12,3,2,To the people of Mexico: To the peoples and governments of the world: To the different non - governmental organizations:
12,3,3,Brothers:
12,3,4,The Clandestine Revolutionary Indigenous Committee - General Command of the Zapatista National Liberation Army addresses itself to you in order to declare the following:
12,3,5,"First: The CCRI of the EZLN, as we have have recently reported, has finished its consultations in all of the communities that make up the EZLN."
12,3,6,"Second: In order to inform the Mexican people about the details of the internal and external consultations that we have carried out regarding the peace accords that the federal government presented to us during the dialogue in San Cristóbal de las Casas, the CCRI of the EZLN wants to report the following figures from the internal consultations:"
12,3,7,-  - The consultations took place in every community and ejido where there are members of the EZLN.
12,3,8,"-  - The study, analysis, and discussion of the peace accords took place in democratic assemblies. The voting was direct, free, and democratic."
12,3,9,"-  - After the voting, official reports of the results of the assemblies were prepared. These reports specify: the date and place of the assembly, the number of people who attended (men, women and children older than 12 years old), opinions and principal points discussed, and the number of people who voted."
12,3,10,"-  - Of the Zapatista population who took part in the consultations, 100% were Indigenous, 49.54% were adult men, 42.13% were adult women and 8.32% were children over 12 years old."
12,3,11,"-  - After studying, analyzing, and discussing the peace accords, those in attendance could vote on whether to sign the peace accords or not sign them."
12,3,12,"-  - In addition, after voting yes or no to the peace accords, proposals were made about what actions we should take."
12,3,13,Third: At this time we are counting the votes of the internal consultations and analyzing the results of the external consultations. We will continue to inform the Mexican people about the results.
12,3,14,"Democracy! Freedom! Justice! Respectfully,"
12,3,15,Clandestine Revolutionary Indigenous Committee -  General Command of the Zapatista National Liberation Army
12,4,0,Results of the Consultations
12,4,1,"[La Jornada, 6/12] June 10, 1994"
12,4,2,To the people of Mexico: To the peoples and governments of the world: To the different Non - governmental organizations: To the commissioner for peace and reconciliation in Chiapas: To the national and international press:
12,4,3,The Clandestine Revolutionary Indigenous Committee - General Command of the Zapatista National Liberation Army addresses itself to you in order to report and declare the following:
12,4,4,"First: The CCRI - CG of the EZLN, as we have recently reported, has finished its consultations in all of the communities that make up and support the EZLN. By means of official reports from assemblies in the ejidos and communities, we have learned the opinions that are in our people's hearts."
12,4,5,"Second: The CCRI - CG of the EZLN has now counted the votes concerning the peace accord proposals presented to the EZLN by the federal government during the dialogue that took place in San Cristóbal de las Casas, Chiapas."
12,4,6,Third: The result of the free and democratic voting in the assemblies is as follows:
12,4,7,In favor of signing the government's peace accord proposals -  - 2.11% of the total
12,4,8,Against signing the government's peace accord proposals -  - 97.88% of the total
12,4,9,Fourth: The result of the voting about what actions we should take in case it was decided not to sign the government's peace accords is as follows:
12,4,10,In favor of renewing the hostilities -  - 3.26% of the total.
12,4,11,In favor of continued resistance and the convening of a new national dialogue to be attended by all of the independent and honest forces in the country -  - 96.74% of the total.
12,4,12,"Fifth: Therefore, in accordance with the majority of the Zapatistas, the CCRI - CG of the EZLN wishes to inform you that:"
12,4,13,It rejects the peace accord proposals presented by the federal government.
12,4,14,"It considers the Dialogue of San Cristóbal to have ended. It calls on the Mexican people to attend a new national dialogue to be attended by all of the progressive forces in the country. The central themes of this dialogue will be democracy, freedom, and justice for all Mexicans."
12,4,15,"In order not to impede the search for a political solution to the conflict and so as to not interfere in the electoral process that will take place this coming August, the CCRI - CG of the EZLN orders its regular and irregular forces in national territory and outside of Mexico to respect a unilateral offensive cease - fire."
12,4,16,The EZLN guarantees that it will take no offensive military action against the Federal Army.
12,4,17,The EZLN will not interfere with the upcoming elections in the territories under its control. It will permit the installation of electoral polls in these territories under the supervision of the different non - governmental organizations and the International Red Cross.
12,4,18,"The EZLN will accept absolutely no aid from the municipal, state or federal governments. It will resist the military siege by its owns means, and with the help of the Mexican people."
12,4,19,"Sixth: The CCRI - CG of the EZLN thanks the Commissioner for Peace and Reconciliation in Chiapas, Manuel Camacho Solís, for his true efforts in search of a political solution to the conflict. Unfortunately, the historic blindness of the supreme government kept it from seeing that its unwillingness to give in to the democratic impulse will bring about painful conflicts and unforeseen consequences."
12,4,20,"Seventh: The CCRI - CG of the EZLN thanks the National Mediator, Bishop Samuel Ruiz García, and his working group, for their efforts and sacrifices in attempting to mediate between the parties involved in the conflict, their integrity in withstanding pressures and threats, and their willingness to listen. We hope that in the new dialogue that we are calling for today we can count on his honest participation in search of political solutions to the national demands for democracy, freedom, and justice."
12,4,21,"Eighth: The CCRI - CG of the EZLN thanks the honest and independent media for its commitment to the truth, and for having presented the truth to the Mexican people despite threats, pressure, and blackmail. We would like to publicly apologize if we have doubted your profession at any point with our clumsy media policy. We hope that you understand that this is the first time that we have tried to carry out a revolution, and we are still learning. We would like to reiterate that, thanks to the efforts of the press, it was possible to stop the military phase of the war. We sincerely hope that you understand the difficult conditions we found ourselves in, and our unfair selection of media that we allowed to approach us. We hope that you continue publishing the truth."
12,4,22,"Ninth: The CCRI - CG of the EZLN especially thanks the different non - governmental organizations, the vanguard of civil society. The NGOs have carried out a selfless work in order to bring about a peace with justice and dignity for our people. The government's siege keeps us, for the moment, from arriving at a pact with these organizations. We are still open to dialogue and are willing to continue down the path that the NGOs have pointed out to us with their commitment: a political route in the transition to democracy."
12,4,23,"Tenth: The CCRI - CG of the EZLN thanks all those men, women and children, people without faces, throughout the country and outside of Mexico, who have given us their solidarity and who have joined our just cause. Our struggle and death is for you, brothers and sisters. We will not take off our masks until every Mexican -  - the Indigenous peoples, campesinos, workers, students, teachers, housewives, squatters, artists, intellectuals, retirees, the unemployed -  - men and women without voices or faces -  - have everything they need for a dignified and true life. Everything for everyone, nothing for ourselves."
12,4,24,"While the national flag waves without democracy, freedom and justice above Mexican soil, we, our tender fury, will continue fighting."
12,4,25,Democracy! Freedom! Justice!
12,4,26,"Respectfully,"
12,4,27,Clandestine Revolutionary Indigenous Committee -  General Command of the Zapatista National Liberation Army From the mountains of the Mexican Southeast
12,5,0,On the Zapatista Response to the Peace Accord Proposals
12,5,1,"[La Jornada, 6/12] June 10, 1994"
12,5,2,To the people of Mexico: To the people and governments of the world: To the national and international press:
12,5,3,Brothers and Sisters:
12,5,4,The Clandestine Revolutionary Indigenous Committee - General Command of the Zapatista National Liberation Army respectfully addresses itself to you to make known its response to the peace accord proposals presented to us by the supreme government during the Dialogue for Peace and Reconciliation in Chiapas.
12,5,5,"First: The Zapatista National Liberation Army, the majority of whose members are Indigenous peoples, rose up against the supreme government on January 1, 1994. The demands of the EZLN can be found in the Declaration from the Lacandona Jungle: work, land, shelter, food, health, education, independence, freedom, democracy, justice, and peace. These demands are supported by the majority of the Mexican people, and the EZLN is fighting for the fulfillment of these demands for all Mexicans."
12,5,6,"Second: After bloody fighting between our troops and government forces from the police and Federal Army, a national civil movement obligated us to stop the fighting and enter a dialogue with the supreme government. This dialogue took place in San Cristóbal de las Casas at the end of February and beginning of March, 1994."
12,5,7,"Third: During the dialogue, the EZLN presented a list of 34 demands whose resolution would lead to a peace with justice and dignity."
12,5,8,"Fourth: The list of 34 demands addressed national and state concerns, some of which affected the entire population, and some of which only referred to campesinos and Indigenous peoples. The supreme government tried in vain to reduce the importance of our just struggle to local, Indigenous concerns. They even tried to reduce its importance to concerns in four townships in the southeastern state of Chiapas."
12,5,9,Fifth: Among the national demands that affect the entire population:
12,5,10,A: Free and democratic elections. These should be held with equal rights and obligations for all political forces.
12,5,11,"B: In order to guarantee freedom and democracy, we demand the resignation of the head of the federal executive power, as well as the resignations of the illegitimate heads of the state executive powers. Upon the resignation of the president of the Republic, a transitional government should be formed that will organize free and democratic elections. We also demand the passage of legislation to guarantee the rights of citizens and groups of citizens, regardless of their party affiliation, to participate in the electoral process, as the highest political authority."
12,5,12,C: We demand a new federal agreement that will end centralism and permit autonomy for Indigenous communities and townships.
12,5,13,D: We demand a review of the North American Free Trade Agreement signed with Canada and the United States because the agreement doesn't correspond with Mexico's reality.
12,5,14,E: We demand dignified work and a just salary for all workers in the country and in the cities. We also demand that the Federal Labor Law be applied and respected for the benefit of the workers in the country and in the cities.
12,5,15,F: We demand an end to the looting of our national resources.
12,5,16,"G: We demand the cancellation of all debts brought about by credit, loans, or taxes."
12,5,17,H: We demand solutions to the national problems of hunger and malnutrition that affect the Mexican country and cities.
12,5,18,I: We demand immediate and unconditional freedom for all political prisoners and poor people unjustly held prisoner in jails throughout the country.
12,5,19,"Sixth: The supreme government avoided responding positively to these national demands of the EZLN, demands that are shared by broad sectors of the Mexican people. The events that happened after the dialogue in San Cristóbal have shown the reason behind the EZLN's demands for democracy. The cowardly murder of Colosio, the imposed designation of Zedillo as the PRI's candidate, and the new enterprise with which the government hard - liners have been advancing, demonstrate that it would have been best for the nation if Salinas de Gortari had resigned as head of the federal executive after January 1. His keen desire to stay in power has kept our country in a permanent state of insecurity. His desire to continue his usurpation through election fraud, and now with Zedillo, has pushed our nation to the brink of civil war."
12,5,20,"The electoral reform was incomplete. The continuing existence of a corrupt electoral process allows electronic fraud, and reinforces the usurpation of the people's will. The reinforcement of the government's repressive apparatus, and the attempt to force the Federal Army to assume police duties, allows us to see very clearly that the goal of Salinas's group is not a transition to democracy, but to fraud."
12,5,21,The Zapatista National Liberation Army confirms what reality points out: There is no democratic impulse on the part of the supreme government. The state - party system must be destroyed. The EZLN reiterates the demands expressed in points one and two of the list presented in San Cristóbal:
12,5,22,One: Free and democratic elections.
12,5,23,Two: The overthrow of the usurpers in the federal government and in the governments of the states of the Federation.
12,5,24,The EZLN broadens its demands:
